{"$comment":"sv0cov.diagnostic-registry 1.0 (SPEC 20.5.1). Lexical rules (COV code shape, byte bounds), ordering, uniqueness, code ranges, and the self-digest are semantic checks.","$defs":{"digest":{"description":"Lowercase hexadecimal SHA-256; lexical form is a semantic check.","maxLength":64,"minLength":64,"type":"string"},"entry":{"additionalProperties":false,"properties":{"code":{"maxLength":7,"minLength":7,"type":"string"},"default_severity":{"enum":["error","note","warning"]},"domain":{"enum":["collection","distribution","evidence","internal","invocation","merge","planning","reporting","reserved","security"]},"title":{"maxLength":128,"minLength":1,"type":"string"}},"required":["code","default_severity","domain","title"],"type":"object"}},"$schema":"https://json-schema.org/draft/2020-12/schema","additionalProperties":false,"properties":{"entries":{"items":{"$ref":"#/$defs/entry"},"maxItems":9999,"minItems":1,"type":"array"},"registry_sha256":{"$ref":"#/$defs/digest"},"revision":{"maximum":4294967295,"minimum":1,"type":"integer"},"schema":{"const":"sv0cov.diagnostic-registry"},"version":{"const":"1.0"}},"required":["entries","registry_sha256","revision","schema","version"],"type":"object"}
