{"entries":[{"code":"COV0001","default_severity":"error","domain":"invocation","title":"Invalid command-line invocation"},{"code":"COV0002","default_severity":"error","domain":"invocation","title":"Invalid coverage configuration"},{"code":"COV0010","default_severity":"error","domain":"invocation","title":"Unsupported configuration schema"},{"code":"COV0011","default_severity":"error","domain":"invocation","title":"Unknown configuration key"},{"code":"COV0012","default_severity":"error","domain":"invocation","title":"Invalid configuration value"},{"code":"COV0013","default_severity":"error","domain":"invocation","title":"Conflicting configuration values"},{"code":"COV0014","default_severity":"error","domain":"invocation","title":"Invalid scope pattern"},{"code":"COV0015","default_severity":"error","domain":"invocation","title":"Invalid threshold value"},{"code":"COV0016","default_severity":"error","domain":"invocation","title":"Unsupported Python interpreter"},{"code":"COV1004","default_severity":"error","domain":"planning","title":"Source digest mismatch"},{"code":"COV1010","default_severity":"error","domain":"planning","title":"Invalid coverage map"},{"code":"COV1011","default_severity":"error","domain":"planning","title":"Unsupported coverage-map version"},{"code":"COV1012","default_severity":"error","domain":"planning","title":"Unsupported coverage-map capability"},{"code":"COV1013","default_severity":"error","domain":"planning","title":"Coverage-map identity mismatch"},{"code":"COV1014","default_severity":"error","domain":"planning","title":"Coverage point identity mismatch"},{"code":"COV1015","default_severity":"error","domain":"planning","title":"Invalid counter or fragment binding"},{"code":"COV1020","default_severity":"error","domain":"planning","title":"Coverage instrumentation failed"},{"code":"COV1021","default_severity":"error","domain":"planning","title":"Unsupported coverage attribute placement"},{"code":"COV2001","default_severity":"error","domain":"collection","title":"Invalid runtime transport"},{"code":"COV2002","default_severity":"error","domain":"collection","title":"Runtime entropy unavailable"},{"code":"COV2010","default_severity":"error","domain":"collection","title":"Raw profile unavailable"},{"code":"COV2011","default_severity":"error","domain":"collection","title":"Raw profile incomplete"},{"code":"COV2012","default_severity":"error","domain":"collection","title":"Raw profile checksum mismatch"},{"code":"COV2103","default_severity":"error","domain":"collection","title":"Unsupported raw-profile version"},{"code":"COV2110","default_severity":"error","domain":"collection","title":"Invalid raw-profile structure"},{"code":"COV2111","default_severity":"error","domain":"collection","title":"Raw-profile map mismatch"},{"code":"COV2112","default_severity":"error","domain":"collection","title":"Raw-profile identity collision"},{"code":"COV2120","default_severity":"error","domain":"collection","title":"Unsupported process lifecycle"},{"code":"COV2130","default_severity":"error","domain":"collection","title":"Test command failed"},{"code":"COV2201","default_severity":"error","domain":"collection","title":"Invalid VM coverage binding"},{"code":"COV2202","default_severity":"error","domain":"collection","title":"VM bytecode binding mismatch"},{"code":"COV3001","default_severity":"error","domain":"merge","title":"No accepted coverage profile"},{"code":"COV3002","default_severity":"error","domain":"merge","title":"Coverage input rejected"},{"code":"COV3003","default_severity":"error","domain":"merge","title":"Run selection failed"},{"code":"COV3004","default_severity":"error","domain":"merge","title":"Source-version conflict"},{"code":"COV3010","default_severity":"error","domain":"merge","title":"Invalid indexed evidence"},{"code":"COV3011","default_severity":"error","domain":"merge","title":"Indexed semantic projection mismatch"},{"code":"COV3012","default_severity":"error","domain":"merge","title":"Indexed map binding mismatch"},{"code":"COV3201","default_severity":"error","domain":"merge","title":"Invalid coverage exclusion"},{"code":"COV3202","default_severity":"error","domain":"merge","title":"Conflicting coverage exclusions"},{"code":"COV3203","default_severity":"error","domain":"merge","title":"Redundant coverage exclusion"},{"code":"COV3207","default_severity":"error","domain":"merge","title":"Coverage exclusion has no reason"},{"code":"COV4001","default_severity":"error","domain":"reporting","title":"Invalid native report"},{"code":"COV4002","default_severity":"error","domain":"reporting","title":"Report invariant mismatch"},{"code":"COV4010","default_severity":"error","domain":"reporting","title":"Output destination collision"},{"code":"COV4011","default_severity":"error","domain":"reporting","title":"Report publication failed"},{"code":"COV4020","default_severity":"error","domain":"reporting","title":"Saturated evidence is ineligible"},{"code":"COV4021","default_severity":"warning","domain":"reporting","title":"Lossy saturated export requested"},{"code":"COV4101","default_severity":"error","domain":"reporting","title":"Coverage threshold failed"},{"code":"COV4102","default_severity":"error","domain":"reporting","title":"Coverage scope is empty"},{"code":"COV4103","default_severity":"error","domain":"reporting","title":"Metric is inapplicable to entity"},{"code":"COV4201","default_severity":"error","domain":"reporting","title":"Coverage ratchet failed"},{"code":"COV4301","default_severity":"error","domain":"reporting","title":"Changed-region base is missing"},{"code":"COV4302","default_severity":"error","domain":"reporting","title":"Changed-region base cannot be resolved"},{"code":"COV4303","default_severity":"error","domain":"reporting","title":"Changed-region merge base is ambiguous"},{"code":"COV4304","default_severity":"error","domain":"reporting","title":"Compiled untracked source is unsupported"},{"code":"COV4305","default_severity":"error","domain":"reporting","title":"Source changed during coverage run"},{"code":"COV4401","default_severity":"error","domain":"reporting","title":"Standard export is invalid"},{"code":"COV4402","default_severity":"error","domain":"reporting","title":"Export commit manifest is invalid"},{"code":"COV5001","default_severity":"error","domain":"distribution","title":"Unsupported installation or platform"},{"code":"COV5002","default_severity":"error","domain":"distribution","title":"Release or submodule compatibility failed"},{"code":"COV5003","default_severity":"error","domain":"distribution","title":"Licensing evidence is incomplete"},{"code":"COV5004","default_severity":"error","domain":"distribution","title":"Doctor probe failed"},{"code":"COV6001","default_severity":"error","domain":"security","title":"Resource limit exceeded"},{"code":"COV6002","default_severity":"error","domain":"security","title":"Unsafe path or filesystem object"},{"code":"COV6003","default_severity":"error","domain":"security","title":"Public-artifact privacy violation"},{"code":"COV7001","default_severity":"error","domain":"evidence","title":"Conformance evidence failed"},{"code":"COV7002","default_severity":"error","domain":"evidence","title":"Performance gate failed"},{"code":"COV7003","default_severity":"error","domain":"evidence","title":"Determinism gate failed"},{"code":"COV8001","default_severity":"error","domain":"internal","title":"Internal invariant failed"},{"code":"COV8002","default_severity":"error","domain":"internal","title":"Diagnostic registry is invalid"},{"code":"COV8003","default_severity":"error","domain":"internal","title":"Unknown diagnostic code"}],"registry_sha256":"1c2cd283986f9474f0e51196d969ed9fd57f48f29ba9704a00e76b9175ed917f","revision":2,"schema":"sv0cov.diagnostic-registry","version":"1.0"}
